{"id":"self-teacher-succession","strong_form":"Innovators whose key capability was self-taught produce markedly fewer eminent students than innovators trained in master-apprentice lineages, and no known method reliably passes self-teaching on.","weak_form":"Self-teaching is hard to transmit, and eminence often runs through apprenticeship chains rather than through lone autodidacts.","kind":"problem","refuted_if":"A bibliometric comparison shows self-taught or outsider innovators have as many eminent students as lineage-trained ones, or an intervention measurably raises autodidactic ability in students.","synonyms":["masters and apprentices","academic genealogy","tacit knowledge transmission (Polanyi)","bilateral associative selection"],"prior_art":[{"citation":"Physics-L archive: Einstein 'had no school (like Bohr)'; later envied Bohr for founding a school","url":"https://www.phys-l.org/archives/1997/10_1997/msg00139.html","relation":"anticipates"},{"citation":"Physics-L reply noting Pais describes some Einstein students","url":"https://phys-l.org/archives/1997/10_1997/msg00296.html","relation":"refutes"},{"citation":"Zuckerman, Scientific Elite: 48 of 92 US laureates trained under laureates; Nobel subnetworks span four generations","url":"https://link.springer.com/article/10.1007/s11192-017-2364-4","relation":"supports"},{"citation":"Oxford study of the UK scientific ultra-elite replicating Zuckerman's selection processes","url":"https://ora.ox.ac.uk/objects/uuid:f7a28a5d-b8fd-44ee-8a7f-56474be14669","relation":"supports"}],"strongest_criticism":"Einstein having no school may reflect his career (few teaching posts, solitary style, opposition to quantum mechanics) rather than self-teaching. Einstein was also not really self-taught: he trained at ETH. The Zuckerman lineage data show that schools transmit eminence, but nobody has done the matched comparison of self-taught versus trained masters. 'Nobody knows how' cannot be refuted by any single observation.","verdict":"untested","novelty":2,"content":2,"survival":1,"confidence":0.55}
