{"id":"growth-obligations","strong_form":"Institutions whose structure presumes continued exponential growth (e.g. universities training more PhDs than faculty slots, defined-benefit pensions assuming high returns, tenure pyramids) show measurably more zero-sum conflict, credential gatekeeping, and rent-seeking after their growth slows than comparable institutions that never assumed growth, and societies show the same shift in stagnant periods.","weak_form":"Stagnation turns positive-sum institutional games into zero-sum ones, worsening behavior.","kind":"claim","refuted_if":"Periods or institutions where growth halted without rises in distributional conflict, gatekeeping, or intolerance; or evidence that rent-seeking rises with stability regardless of growth rate (Olson) rather than following growth stops.","synonyms":["embedded growth obligations (Weinstein)","zero-sum thinking under stagnation","moral consequences of economic growth (B. Friedman)","distributional coalitions / institutional sclerosis (Olson)","Ponzi dynamics"],"prior_art":[{"citation":"Benjamin M. Friedman, The Moral Consequences of Economic Growth (2005), reviewed in Commentary: low growth breeds zero-sum, mean-spirited politics","url":"https://www.commentary.org/articles/dan-seligman/the-moral-consequences-of-economic-growth-by-benjamin-m-friedman/","relation":"anticipates"},{"citation":"Exhale #32: Embedded Growth Obligations (Weinstein's term)","url":"https://mcaz.substack.com/p/embedded-growth-obligations","relation":"anticipates"},{"citation":"Mancur Olson, The Rise and Decline of Nations: distributional coalitions accumulate and slow growth","url":"https://en.wikipedia.org/wiki/Mancur_Olson","relation":"anticipates"},{"citation":"Reason 1983 review of Olson criticizing the overbroad coalition concept","url":"https://reason.com/1983/08/01/does-great-prosperity-take-lit/","relation":"refutes"},{"citation":"FEE review critical of Friedman's thesis","url":"https://fee.org/articles/the-moral-consequences-of-economic-growth/","relation":"refutes"}],"strongest_criticism":"Friedman's own evidence relies on loosely labeled historical periods and a vague moral outcome, and Olson's account runs causality the other way (rent-seeking coalitions cause slow growth), so the claimed direction is contested. The claim is also widely stated (Friedman, Olson, Ponzi-scheme critiques of pensions), so the specific institutional framing adds little beyond a new label.","verdict":"survives-qualified","novelty":1,"content":3,"survival":2,"confidence":0.6}
