{"id":"reality-second-best","strong_form":"Highly agentic or eminent people experienced an early break from normal social embedding (e.g. parental loss, exile, illness, ostracism) at rates well above those of matched non-eminent peers.","weak_form":"Early disruption of social belonging is correlated with later independence of mind in some eminent populations.","kind":"claim","refuted_if":"Matched-cohort data show eminent or high-agency people had early social ruptures at rates no higher than comparable non-eminent controls.","synonyms":["eminent orphans effect","parental loss and achievement","post-traumatic growth","marginality hypothesis","desirable difficulties","Gladwell's 'remote misses'"],"prior_art":[{"citation":"Eisenstadt 1978, 'Parental Loss and Genius', American Psychologist (699 eminent persons; high orphanhood rates)","url":"https://Www.Gwern.net/doc/psychology/1978-eisenstadt.pdf","relation":"anticipates"},{"citation":"Eugene Wei, 'Eminent orphans' (bereavement also high among less eminent achievers)","url":"https://www.eugenewei.com/blog/2013/11/27/eminent-orphans","relation":"refutes"},{"citation":"Gregory 1965 on whether eminence arises in spite of or because of early adversity","url":"https://Www.Gwern.net/doc/psychology/1965-gregory.pdf","relation":"anticipates"},{"citation":"WGBH, 'Successful children who lost a parent: why are there so many of them?'","url":"https://www.wgbh.org/news/2013-10-16/successful-children-who-lost-a-parent-why-are-there-so-many-of-them","relation":"supports"}],"strongest_criticism":"The evidence is mostly historical samples with poor baselines: parental death was common before modern medicine, and delinquents and psychiatric patients show high bereavement too, so the rupture may raise variance rather than agency. 'Break with social reality' is loose enough to fit almost any biography, and 'usually' is not quantified. 'High agency' has no agreed measure.","verdict":"contested","novelty":1,"content":2,"survival":1,"confidence":0.55}
