{"id":"conjugate-crawler","strong_form":"A program that counts, in a news outlet's text, the relative use of emotively loaded versus neutral members of synonym sets (Russell conjugates, e.g. 'firm/obstinate/pig-headed') yields a slant score that correlates well with independent measures of slant (human-coded bias ratings, audience ideology, or partisan-phrase indices) without human reading of the articles.","weak_form":"Word choice among near-synonyms carries a measurable slant signal that a lexicon can partly detect, useful as one input alongside validation.","kind":"claim","refuted_if":"A conjugate-lexicon score, applied to a large corpus of outlets, shows low agreement with human-coded slant or audience ideology, or results flip across reasonable lexicon choices, as has been found for off-the-shelf sentiment dictionaries.","synonyms":["emotive conjugation","Russell's conjugation","loaded language detection","dictionary-based / lexicon-based sentiment analysis","media slant index","framing analysis"],"prior_art":[{"citation":"Wikipedia, 'Emotive conjugation' (Russell, BBC Brains Trust 1948)","url":"https://en.wikipedia.org/wiki/Emotive_conjugation","relation":"anticipates"},{"citation":"Future of Capitalism, quoting Eric Weinstein's post on Russell Conjugation proposing a crawler against a look-up table of conjugates","url":"https://www.futureofcapitalism.com/2017/06/russell-conjugation","relation":"anticipates"},{"citation":"Gentzkow & Shapiro, 'What Drives Media Slant?' (NBER w12707 / Econometrica 2010): slant measured from frequencies of partisan phrases like 'death tax'","url":"https://www.nber.org/index%2ephp/papers/w12707","relation":"anticipates"},{"citation":"npm package 'loaded-language' identifying bias-creating terms","url":"https://npmjs.org/package/loaded-language","relation":"anticipates"},{"citation":"Boukes et al., 'What's the Tone? Easy Doesn't Do It': off-the-shelf sentiment dictionaries show poor validity and little agreement on news","url":"https://dare.uva.nl/id/6d87f088-1e62-4797-b2b3-75744f8a1ec1","relation":"refutes"},{"citation":"'Four best practices for measuring news sentiment using off-the-shelf dictionaries: a large-scale p-hacking experiment'","url":"https://www.mzes.uni-mannheim.de/en/publications/details/four-best-practices-for-measuring-news-sentiment-using-off-the-shelf-dictionaries-a-large-scale-p-hacking-experiment","relation":"refutes"}],"strongest_criticism":"The data-driven version already exists and works (Gentzkow-Shapiro learn partisan phrases from Congress and validate against reader ideology), so the idea is not new; meanwhile the hand-built-lexicon version faces the documented failure of dictionary methods on news, where connotation depends on context, quotation, and audience, and scores vary wildly across lexicons. 'Without reading it' also hides that someone must read enough to build and validate the conjugate table, and outlets quoting opponents' loaded terms will be misscored.","verdict":"survives-qualified","novelty":1,"content":2,"survival":2,"confidence":0.7}
