{"id":"ld-super-learners","strong_form":"People with a learning-disability label are over-represented among the most intellectually accomplished people (top achievers in science, art, business) compared with their population base rate.","weak_form":"Some LD subgroups (e.g. dyslexia among entrepreneurs) are over-represented in specific high-achievement niches, and the label can mask high ability (twice-exceptional).","kind":"claim","refuted_if":"Representative samples of top achievers show LD rates at or below the population base rate, or LD-labeled cohorts show lower average and lower top-percentile attainment.","synonyms":["twice-exceptional (2e)","neurodiversity advantage","dyslexic advantage","desirable difficulty"],"prior_art":[{"citation":"Logan, 'Dyslexic entrepreneurs: the incidence; their coping strategies and their business skills', Dyslexia 2009 (35% of US entrepreneurs self-report dyslexia vs 1% of corporate managers)","url":"https://www.researchgate.net/profile/Julie-Logan-2/publication/242137499_ANALYSIS_OF_THE_INCIDENCE_OF_DYSLEXIA_IN_ENTREPRENEURS_AND_ITS_IMPLICATIONS/links/55d191c708ae502646aa59df/ANALYSIS-OF-THE-INCIDENCE-OF-DYSLEXIA-IN-ENTREPRENEURS-AND-ITS-IMPLICATIONS.pdf","relation":"supports"},{"citation":"NPR, 'Does Dyslexia Translate to Business Success?' (2007)","url":"https://www.npr.org/2007/12/26/17611066/does-dyslexia-translate-to-business-success","relation":"supports"},{"citation":"Eloranta 2019, Finnish longitudinal dissertation: childhood LD linked to lower educational attainment and more unemployment","url":"https://jyx.jyu.fi/handle/123456789/66402?show=full","relation":"refutes"},{"citation":"Conti-Ramsden et al. 2018, JSLHR: developmental language disorder linked to lower qualifications","url":"https://pubs.asha.org/doi/pdf/10.1044/2020_JSLHR-20-00127","relation":"refutes"},{"citation":"Adults with Learning Disabilities 8-15 Years after College (no difference in degree completion among college grads)","url":"https://www.js.sagamorepub.com/index.php/ldmj/article/view/5422","relation":"supports"}],"strongest_criticism":"Longitudinal cohorts show that LD-labeled people on average reach lower educational attainment and higher unemployment, so the general claim fails. The best supporting evidence is a small self-report survey of entrepreneurs, which is one niche and is open to selection effects (dyslexic people pushed out of credentialed careers into self-employment), so it says nothing about intellectual accomplishment in general. Lists of famous 'LD geniuses' are anecdotal and often rest on retrospective diagnosis.","verdict":"refuted-strong-form","novelty":1,"content":2,"survival":1,"confidence":0.7}
