{"id":"excellence-vs-genius","strong_form":"Credentialing systems select and train for reliability (low outcome variance), and in fields where payoffs are power-law distributed this selection lowers the expected count of extreme right-tail contributions compared with admitting or cultivating higher-variance people and methods.","weak_form":"Schools reward consistency and penalize idiosyncratic profiles, so some high-variance people get screened out of credentialed paths.","kind":"claim","refuted_if":"Among top-percentile contributors in power-law fields (e.g. most-cited scientists, founders of the largest firms), credentialed low-variance performers are over-represented compared with high-variance or non-credentialed peers once base rates are controlled, or programs designed to widen variance yield no more tail outcomes than standard selection.","synonyms":["mean-variance tradeoff applied to talent","explore vs exploit","barbell strategy","convexity / optionality (Taleb)","conformity selection in education"],"prior_art":[{"citation":"Big Think, 'Our Cult of Achievement Is Crushing the Genius Out of People' (excellence as quality control vs high-variance genius)","url":"https://bigthink.com/?p=49039","relation":"anticipates"},{"citation":"Gamermann et al., 'Power law distribution in High School Education' (power-law tails appear in science grades, not humanities)","url":"https://arxiv.org/pdf/cond-mat/0301523","relation":"supports"},{"citation":"iqmindware Substack, 'The Cognitive Power Curve' (ability itself is normally distributed; power law applies to outcomes)","url":"https://iqmindware.substack.com/p/the-cognitive-power-curve-why-intelligence","relation":"refutes"},{"citation":"Zuckerman, Scientific Elite (many US Nobel laureates trained under laureates in elite credentialed settings)","url":"https://link.springer.com/article/10.1007/s11192-017-2364-4","relation":"refutes"}],"strongest_criticism":"Elite credentialed pipelines produce a large share of right-tail scientific outcomes (Zuckerman's laureate lineages), which suggests credentialing concentrates tail talent rather than suppressing it. High variance also means many more failures, and nobody has shown that the extra tail gains from loosening selection outweigh the extra losses. As stated the claim is a plausible decision-theory argument without a direct empirical test.","verdict":"contested","novelty":1,"content":3,"survival":1,"confidence":0.6}
