{"id":"four-quadrants","strong_form":"Mainstream media coverage collapses two independent axes (support vs. opposition to elite-favored policies, e.g. high immigration or trade liberalization; and moral decency vs. bigotry) into one, so that people who oppose such a policy on principled, non-bigoted grounds are disproportionately portrayed as bigots, compared with how equally principled supporters are portrayed.","weak_form":"Some coverage conflates policy opposition with prejudice, making nuanced dissenting positions hard to communicate.","kind":"claim","refuted_if":"Content analysis showing that coverage of principled opponents of elite-favored policies attributes bigotry no more often than warranted by their stated reasoning, or no more often than coverage attributes bad motives to supporters; or audiences reliably distinguishing the axes in coverage.","synonyms":["Four Quadrant Model (Weinstein)","conflation / false dichotomy","guilt by association","poisoning the well","moralization of policy disagreement","stigmatization of heterodox views"],"prior_art":[{"citation":"The Portal Wiki, 'The Four Quadrant Model': media stigmatizes nuanced views by portraying holders as prejudiced","url":"https://theportal.wiki/wiki/The_Four_Quadrant_Model","relation":"anticipates"},{"citation":"Medium, 'Eric Weinstein's Four Quadrant Model' (The Knife Media)","url":"https://medium.com/@rljunco/eric-weinsteins-four-quadrant-model-the-knife-media-6e642ff3f54b","relation":"anticipates"},{"citation":"LSE, 'Is tribalism racist? Antiracism norms and immigration'","url":"https://researchonline.lse.ac.uk/id/eprint/83984","relation":"supports"},{"citation":"2025 paper on attitude moralization and harsher outgroup judgments","url":"https://gwern.net/doc/psychology/cognitive-bias/2025-loustau.pdf","relation":"supports"}],"strongest_criticism":"As stated it is a model fitted to anecdotes (e.g. one interview) with no systematic content analysis; 'principled opponent' is defined by the claimant, so any bigotry charge can be dismissed as misclassification, making it hard to refute. The asymmetry is also untested: supporters of elite policy are routinely painted as corrupt or treasonous by other outlets, so the effect may be partisan-media-wide rather than elite-direction-specific.","verdict":"untested","novelty":2,"content":2,"survival":1,"confidence":0.6}
