{"id":"cpi-stealth-tax","strong_form":"When the official inflation measure used for indexing is revised downward (e.g. chained CPI, Boskin-era methodology changes) below the true change in living costs faced by affected groups, real income-tax burdens rise via slower bracket indexing and real benefits fall via smaller COLAs, with less political visibility than an explicit tax rise or benefit cut.","weak_form":"Switching to a lower-growth index mechanically raises revenue and cuts benefit growth, whatever its accuracy.","kind":"claim","refuted_if":"Evidence that the lower index more accurately measures the cost of living for taxpayers and beneficiaries (so the change removes a prior windfall rather than imposing a hidden cut), or that the changes were enacted with full public scoring and debate rather than quietly.","synonyms":["bracket creep","chained CPI debate","hidden tax increase","stealth tax","fiscal drag","COLA cut"],"prior_art":[{"citation":"Senate Aging Committee document, 'A hidden tax increase' (chained CPI)","url":"https://www.aging.senate.gov/download/a-hidden-tax-increase?download=1","relation":"anticipates"},{"citation":"CEPR, 'Chained CPI cuts Social Security benefits while raising taxes on the middle class'","url":"https://cepr.net/newsroom/chained-cpi-cuts-social-security-benefits-while-raising-taxes-on-the-middle-class/","relation":"supports"},{"citation":"Motley Fool on 2017 tax law indexing brackets to chained CPI","url":"https://www.fool.com/retirement/2017/12/18/the-1-gop-tax-provision-social-security-recipients.aspx","relation":"supports"},{"citation":"Boskin Commission (1996): CPI overstated inflation by about 1.1 points/year","url":"https://en.wikipedia.org/wiki/Boskin_Commission","relation":"refutes"},{"citation":"Econlib, 'Did the Boskin Commission lie about inflation?'","url":"https://www.econlib.org/did-the-boskin-commission-lie-about-inflation/","relation":"refutes"},{"citation":"CRFB, 'Once Again, the Chained CPI Is Not Regressive'","url":"https://crfb.org/blogs/once-again-chained-cpi-not-regressive","relation":"refutes"}],"strongest_criticism":"The mechanism is arithmetic and openly scored, not hidden: CBO and advocates on both sides discussed revenue and benefit effects of chained CPI for years. Whether it is a 'tax rise' or a correction depends on whether the old CPI overstated living costs, which the Boskin Commission and most economists think it did; the elderly-specific CPI-E argument is the strongest counter, but contested.","verdict":"survives-qualified","novelty":1,"content":2,"survival":2,"confidence":0.75}
